{
  "schemaVersion": 1,
  "platformVersion": "0.1.0-alpha.1",
  "releaseDate": "2026-03-04",
  "channel": "alpha",
  "compatibility": {
    "moduleGraphSpec": "001",
    "pluginAbiVersion": null
  },
  "releaseNotes": "Core hosting implementation currently lives in NGIN.Core; NGIN.Log and NGIN.Core are required platform components.",
  "components": [
    {
      "name": "NGIN.Base",
      "repoUrl": "https://github.com/NGIN-ORG/NGIN.Base.git",
      "ref": "9c8ce0431dd1d545ff30bbcba78e0421633342c0",
      "version": "0.1",
      "packageName": "NGINBase",
      "role": "foundation",
      "required": true,
      "abiVersion": 1,
      "dependsOn": []
    },
    {
      "name": "NGIN.Log",
      "repoUrl": "https://github.com/NGIN-ORG/NGIN.Log.git",
      "ref": "272625925130cf3cbf9e57008deb7bcdd98c802d",
      "version": "0.1",
      "packageName": "NGINLog",
      "role": "foundation",
      "required": true,
      "abiVersion": 1,
      "dependsOn": [
        "NGIN.Base"
      ]
    },
    {
      "name": "NGIN.Core",
      "repoUrl": "https://github.com/NGIN-ORG/NGIN.Core.git",
      "ref": "272625925130cf3cbf9e57008deb7bcdd98c802d",
      "version": "0.1",
      "packageName": "NGINCore",
      "role": "core",
      "required": true,
      "abiVersion": 1,
      "dependsOn": [
        "NGIN.Base",
        "NGIN.Log"
      ],
      "notes": "Current implementation repository for the central NGIN.Core hosting layer."
    },
    {
      "name": "NGIN.Reflection",
      "repoUrl": "https://github.com/NGIN-ORG/NGIN.Reflection.git",
      "ref": "b0a9afdd9c4ff419ed4d98b5ab460c8d201d67fb",
      "version": "0.1",
      "packageName": "NGINReflection",
      "role": "foundation",
      "required": true,
      "abiVersion": 1,
      "dependsOn": [
        "NGIN.Base"
      ]
    },
    {
      "name": "NGIN.ECS",
      "repoUrl": "https://github.com/NGIN-ORG/NGIN.ECS.git",
      "ref": "266533462d3318d8678064eaef3117f490408bdf",
      "version": "0.1",
      "packageName": "NGINECS",
      "role": "domain",
      "required": false,
      "abiVersion": 1,
      "dependsOn": [
        "NGIN.Base"
      ]
    },
    {
      "name": "NGIN.Editor",
      "repoUrl": "https://github.com/NGIN-ORG/NGIN.Editor.git",
      "ref": null,
      "version": "0.1",
      "packageName": "NGINEditor",
      "role": "optional",
      "required": false,
      "abiVersion": null,
      "dependsOn": [
        "NGIN.Base",
        "NGIN.Core",
        "NGIN.Reflection"
      ],
      "notes": "Planned editor product package; metadata is tracked here before the component repo is pinned."
    },
    {
      "name": "NGIN.Benchmark",
      "repoUrl": "https://github.com/NGIN-ORG/NGIN.Benchmark.git",
      "ref": null,
      "version": "0.1",
      "packageName": "NGINBenchmark",
      "role": "tooling",
      "required": false,
      "abiVersion": null,
      "dependsOn": [
        "NGIN.Base"
      ],
      "notes": "Repository present but no committed HEAD in this workspace snapshot."
    }
  ]
}
